{
  "$schema": "http://json-schema.org/draft-07/schema#",
  "$id": "https://namma-bengaluru/schema/money_entry.schema.json",
  "title": "money_entry",
  "description": "Spec §3.2. One row per figure; a project has many. P1/P2: every figure carries its source, as_of date and kind.",
  "type": "object",
  "additionalProperties": false,
  "required": ["project_id", "fiscal_year", "kind", "amount_cr", "funder", "source_id", "as_of"],
  "properties": {
    "project_id": { "type": "string", "description": "FK to project.id" },
    "fiscal_year": { "type": "string", "pattern": "^[0-9]{4}-[0-9]{2}$", "description": "e.g. 2025-26" },
    "kind": {
      "enum": ["announced", "sanctioned", "revised_cost", "bid_received", "released", "utilised"]
    },
    "amount_cr": { "type": "number", "description": "₹ crore" },
    "funder": {
      "enum": ["state", "centre", "agency_borrowing", "external", "private"]
    },
    "funder_detail": {
      "type": "string",
      "description": "When funder is external: JICA, World Bank, HUDCO, etc."
    },
    "covers": {
      "type": "string",
      "description": "Set when this figure is not for the whole project: what it covers instead (one contract package, one reach, a loan tranche, rolling stock, or a combined figure for several projects). Such figures are shown but never used as the project's cost or overrun."
    },
    "budget_head": {
      "type": "string",
      "description": "Budget line, head of account or scheme name as printed in the source, so the figure can be found again in the document"
    },
    "source_id": { "type": "string", "description": "FK to source.id" },
    "as_of": { "type": "string", "format": "date", "description": "When the figure was true" },
    "comparable_to_prior": {
      "type": "boolean",
      "description": "False where the definition changed (P3)",
      "default": true
    }
  }
}
