{
  "project_id": "metro-phase-3",
  "fiscal_year": "2024-25",
  "kind": "sanctioned",
  "amount_cr": 15611,
  "funder": "state",
  "funder_detail": "Union Cabinet approval; funding split across state/centre/external debt not yet confirmed from a primary document",
  "source_id": "S9",
  "as_of": "2024-08-16",
  "comparable_to_prior": true
}
