{
  "project_id": "purple-line-ext-mysore-road",
  "fiscal_year": "2016-17",
  "kind": "sanctioned",
  "amount_cr": 327,
  "funder": "state",
  "funder_detail": "Reach 2A civil works (Mysuru Road–Pattanagere, 3.94 km, 4 stations), awarded to IL&FS Engineering & Construction Company. as_of is approximate — civil work on this extension is reported to have begun October 2016, but this source (a 2021 progress-inspection article) does not itself give the original award date, only the contract value.",
  "source_id": "S35",
  "as_of": "2016-10-01",
  "comparable_to_prior": true
}
