{
  "project_id": "metro-phase-1",
  "fiscal_year": "2016-17",
  "kind": "sanctioned",
  "amount_cr": 13800,
  "funder": "state",
  "funder_detail": "Reported as Phase 1's sanctioned cost; may already reflect cost escalation rather than the original 2006 approval figure — see project notes",
  "source_id": "S20",
  "as_of": "2016-10-20",
  "comparable_to_prior": true
}
