{
  "project_id": "bsrp",
  "fiscal_year": "2019-20",
  "kind": "announced",
  "amount_cr": 18621,
  "funder": "centre",
  "funder_detail": "Earlier proposed estimate, before the Ministry of Railways requested the state revise it downward",
  "source_id": "S18",
  "as_of": "2020-02-01",
  "comparable_to_prior": true
}
