{
  "project_id": "peripheral-ring-road",
  "fiscal_year": "2026-27",
  "kind": "bid_received",
  "amount_cr": 3348,
  "covers": "Package 1 only (Tumkur Road–Bellary Road, 19.80 km)",
  "funder": "private",
  "funder_detail": "Package 1 only (Tumkur Road–Bellary Road, 19.80 km) — not the full corridor; award not yet finalised as of the as_of date",
  "source_id": "S15",
  "as_of": "2026-05-08",
  "comparable_to_prior": false
}
