{
  "project_id": "purple-line-ext-mysore-road",
  "fiscal_year": "2016-17",
  "kind": "sanctioned",
  "amount_cr": 332,
  "funder": "state",
  "funder_detail": "Reach 2B civil works (Pattanagere–Challaghatta, 4.86 km), awarded to Soma Enterprise. as_of is approximate — see the equivalent note on the Reach 2A entry.",
  "source_id": "S35",
  "as_of": "2016-10-01",
  "comparable_to_prior": true
}
