{
  "project_id": "blue-line-phase-2a",
  "fiscal_year": "2021-22",
  "kind": "sanctioned",
  "amount_cr": 785.24,
  "covers": "Package 1 civil works only (9.859 km, 6 stations)",
  "funder": "state",
  "funder_detail": "Package 1 civil works (9.859 km, 6 elevated stations: Central Silk Board, HSR Layout, Agara, Ibbalur, Bellandur, Kadubeesanahalli), awarded to Afcons Infrastructure",
  "source_id": "S38",
  "as_of": "2021-05-25",
  "comparable_to_prior": true
}
