{
  "project_id": "bsrp",
  "fiscal_year": "2023-24",
  "kind": "sanctioned",
  "amount_cr": 4552,
  "covers": "KfW loan for Corridors 1 and 3 only",
  "funder": "external",
  "funder_detail": "KfW Development Bank loan (€500 million) for Corridors 1 & 3 civil and systems works; KfW also provided a separate €4.5 million (~₹41 cr) grant, not included in this figure",
  "source_id": "S19",
  "as_of": "2023-12-15",
  "comparable_to_prior": false
}
