{
  "project_id": "metro-phase-2",
  "fiscal_year": "2024-25",
  "kind": "revised_cost",
  "amount_cr": 40425,
  "funder": "state",
  "funder_detail": "Cabinet-approved cost hike of ₹9,729.90 cr against ₹30,695.12 cr estimated earlier; exact approval date not confirmed, month/year approximated",
  "source_id": "S1",
  "as_of": "2024-04-01",
  "comparable_to_prior": true
}
