{
  "project_id": "metro-phase-2",
  "fiscal_year": "2014-15",
  "kind": "sanctioned",
  "amount_cr": 26405.14,
  "funder": "state",
  "funder_detail": "As reported; full state/centre/external funding split not yet confirmed from a primary document",
  "source_id": "S2",
  "as_of": "2014-04-01",
  "comparable_to_prior": true
}
