{
  "project_id": "alpine-eco-road-grade-separator",
  "fiscal_year": "2026-27",
  "kind": "announced",
  "amount_cr": 50,
  "funder": "state",
  "funder_detail": "Bengaluru East City Corporation budget allocation; funding source beyond the corporation budget line not further confirmed",
  "source_id": "S25",
  "as_of": "2026-03-27",
  "comparable_to_prior": true
}
