{
  "project_id": "blue-line-phase-2a",
  "fiscal_year": "2021-22",
  "kind": "sanctioned",
  "amount_cr": 623.55,
  "covers": "Package 2 civil works only (8.377 km, 7 stations)",
  "funder": "state",
  "funder_detail": "Package 2 civil works (8.377 km, 7 elevated stations: Kodibeesanahalli, Marathahalli, ISRO, Doddanekundi, DRDO sports complex, Saraswathi Nagar, KR Puram, plus a depot link and pocket track), awarded to Shankaranarayana Constructions",
  "source_id": "S38",
  "as_of": "2021-05-25",
  "comparable_to_prior": true
}
