{
  "project_id": "blue-line-phase-2b",
  "fiscal_year": "2022-23",
  "kind": "sanctioned",
  "amount_cr": 182.33,
  "covers": "Airport depot civil works only",
  "funder": "external",
  "funder_detail": "Airport Depot (Doddajala) civil works, awarded to a J Kumar Infraprojects–AIC Infrastructures joint venture (J Kumar's stake ≈₹100.29 cr excl. GST); BMRCL's own estimate had been ₹204.68 cr. Phase 2B is financed in part by a US$500 million Asian Development Bank loan approved December 2020 — this entry covers only the depot package, not the whole phase.",
  "source_id": "S39",
  "as_of": "2023-03-21",
  "comparable_to_prior": true
}
