{
  "project_id": "blue-line-phase-2a",
  "fiscal_year": "2025-26",
  "kind": "revised_cost",
  "amount_cr": 14788.101,
  "covers": "Phase 2A and 2B combined (58.19 km), more than this project",
  "funder": "state",
  "funder_detail": "Combined Phase 2A+2B (58.19 km) total, not this project's 19.75 km alone — see project notes. Funding: ADB ₹2,410.79 cr, JICA ₹1,310.74 cr, PPP ₹800 cr, Karnataka State ₹4,074.34 cr, Centre ₹1,260.54 cr (these five figures do not sum to the headline total — see notes)",
  "source_id": "S26",
  "as_of": "2025-06-30",
  "comparable_to_prior": false
}
