{
  "project_id": "cubbon-park-upgrade",
  "fiscal_year": "2025-26",
  "kind": "announced",
  "amount_cr": 5,
  "funder": "state",
  "funder_detail": "Grant announced from BDA funds during a public event; no formal sanction order located",
  "source_id": "S24",
  "as_of": "2025-10-26",
  "comparable_to_prior": true
}
