{
  "project_id": "metro-phase-3",
  "fiscal_year": "2025-26",
  "kind": "sanctioned",
  "amount_cr": 9700,
  "covers": "Double-decker flyover works only",
  "funder": "state",
  "funder_detail": "Covers double-decker flyover civil works, land acquisition, design and other expenses: 50% state, 10% urban local bodies, 40% loans; Union government funds the metro line itself, separately",
  "source_id": "S3",
  "as_of": "2025-09-04",
  "comparable_to_prior": false
}
