{
  "project_id": "pink-line",
  "fiscal_year": "2021-22",
  "kind": "sanctioned",
  "amount_cr": 364.87,
  "covers": "Reach 6 elevated section replacement contract only",
  "funder": "state",
  "funder_detail": "Replacement contract for the same Reach 6 elevated section, awarded to GR Infraprojects (lowest bidder, about 7.56% above BMRCL's own ₹339.21 cr estimate) after Simplex Infrastructures' contract was terminated",
  "source_id": "S33",
  "as_of": "2021-07-16",
  "comparable_to_prior": false
}
