{
  "project_id": "metro-phase-3a",
  "fiscal_year": "2025-26",
  "kind": "revised_cost",
  "amount_cr": 25485,
  "funder": "state",
  "funder_detail": "Cabinet approved a ₹2,920 cr reduction from the original ₹28,405 cr estimate",
  "source_id": "S5",
  "as_of": "2025-10-25",
  "comparable_to_prior": true
}
