{
  "project_id": "metro-phase-3a",
  "fiscal_year": "2024-25",
  "kind": "sanctioned",
  "amount_cr": 28405,
  "funder": "state",
  "funder_detail": "Cabinet-approved cost; funding split across state/centre/external debt not yet confirmed from a primary document",
  "source_id": "S5",
  "as_of": "2024-12-01",
  "comparable_to_prior": true
}
