{
  "project_id": "hebbal-silkboard-tunnel",
  "fiscal_year": "2025-26",
  "kind": "announced",
  "amount_cr": 17698,
  "funder": "state",
  "funder_detail": "Government's own estimate ahead of tendering; reported elsewhere as excluding GST",
  "source_id": "S22",
  "as_of": "2025-10-01",
  "comparable_to_prior": true
}
