{
  "project_id": "peripheral-ring-road",
  "fiscal_year": "2021-22",
  "kind": "sanctioned",
  "amount_cr": 21091,
  "funder": "private",
  "funder_detail": "Karnataka Cabinet approval for the full project under a PPP-BOT model; land acquisition alone (over ₹15,000 cr of this total) was to be funded upfront by the concessionaire per this reporting",
  "source_id": "S31",
  "as_of": "2022-02-09",
  "comparable_to_prior": true
}
