{
  "project_id": "metro-phase-3",
  "fiscal_year": "2025-26",
  "kind": "revised_cost",
  "amount_cr": 16300,
  "funder": "state",
  "funder_detail": "Reported as \"over ₹16,300 crore, up 5%\" from the ₹15,611 cr sanctioned figure; exact amount and approval date not confirmed",
  "source_id": "S4",
  "as_of": "2025-08-01",
  "comparable_to_prior": true
}
